Как преодолеть кризис женской идентичности?;

Быть счастливой, состоявшейся и гармоничной — желание каждой женщины. Полноценность женской части и возможность свободно проявлять свою истинность являются главными факторами правильного определения себя и своей роли. Нередко формирование женской идентичности протекает через кризисы. В таком случае женщина сталкивается со множеством проблем.
Кризис идентичности является состоянием, когда женщина вынуждена препятствовать проявлению своей женственности. По разным причинам не происходит удовлетворения собственных потребностей, что в итоге отражается на отношениях с собой, мужчинами и миром.
Что провоцирует кризис женской идентичности?

Травмы и негативный опыт в прошлом. Любые виды насилия и принуждения — ситуации, задевающие женственность, вызывают разрушение ориентиров и собственной ценности.
Возраст. С годами внешность меняется, появляются первые признаки увядания. Возникает негатив к себе и желание все изменить.
Влияние родителей. Из-за родительского давления в детстве женщина переносит во взрослую жизнь некоторые установки, которые подавляют ее потребности и желания.
Создание семьи и рождение детей. Женщина существует только в ролях матери и супруги, отказываясь от карьеры, самореализации, полноценного общения с обществом. Возникает иллюзия стабильности, но замкнутое существование неизменно влечет эмоциональное выгорание.
Развод. Женщина берет всю вину за случившееся на себя и думает, что не смогла реализовать себя в отношениях и семье.


Чем опасен кризис идентичности женщины?
Сложность такого кризиса в том, что он долгое время не проявляет себя. Женщина замечает, что появились проблемы со здоровьем, угасла энергия, в семье стали случаться постоянные конфликты. Возникает разрушающее чувство одиночества, которое влечет острые реакции в виде необоснованной агрессии. Женщина пытается контролировать себя и сдерживать немотивированный гнев, что окончательно заводит в тупик и ведет к потере сил.
Без помощи психолога увидеть кризис идентичности женщины очень трудно. Необходимо самостоятельно обращать внимание на свое физическое и психологическое самочувствие. Если постоянно преследует усталость и болезни сменяют друг друга, а прежней радости от отношений и жизни нет, возможно, вы заблокировали в себе женскую часть. Сначала это сказывается на эмоциональной сфере, а в дальнейшем на фоне стрессе случаются гормональные сбои.
Психолог Екатерина Счасная работает с критическими ситуациями много несколько лет и знает, как преодолеть кризис женской идентичности. Наработанные тактики терапии позволяют экологично прожить все негативные чувства, найти внутренние ресурсы и стабилизироваться. В результате создается самоощущение, которое позволяет проявлять себя, действовать с уважением к своей истинности.
Когда нужен психолог?
Если вы понимаете, что:

рушатся отношения в семье,
нет сил на дела и работу,
постоянно недомогаете без объективных причин,
загнали себя в угол,

значит у вас произошел кризис женской идентичности, с которым не удается справиться. Так бывает и не характеризует вас слабым человеком. Помощь психолога в таком случае позволит использовать кризис во благо — оттолкнуться от негативного опыта и найти женщине себя.

 ;images/1.jpgМатрас для сна;"

Здоровый сон необходим для восстановления организма, выработки важных гормонов, регенерации тканей. Качественный ортопедический матрас – гарантия качественного отдыха. Он сохраняет красивую осанку, укрепляет здоровье. Купить матрас для сна можно в компании 4house. В каталоге большой выбор моделей для людей разного возраста, веса. Рассмотрим подробнее, в чем их преимущества.
Содержание
ПреимуществаКак выбратьОбращение в 4th HouseПреимущества
Благодаря матрасам обеспечивается беспрерывный сон. Исследования доказали, что люди, выбравшие ортопедические изделия, лучше высыпаются, меньше просыпаются за ночь. Сон на них избавляет от различных неврологических отклонений (мигрени, бессонницы).

Другие преимущества:

Поддержка позвоночного столба. Благодаря правильному распределению нагрузки на позвоночный столб, сводится к минимуму риск развития заболеваний спины (остеохондроза, отложения солей).
Удобство. Отдыхать на них гораздо приятнее.
Универсальность. Подходят людям разных возрастных категорий.
Ортопедический эффект. Тело находится в правильном положении, что способствует восстановлению сил.

Как выбрать
При выборе стоит учитывать три главных критерия: жесткость, высота, конструкция. Средняя жесткость – универсальный, подходит всем. Он хорошо поддерживает позвоночный столб в анатомически правильном положении. Мягкие модели предпочтительны пожилым. Для людей с ожирением и маленьким детям, у которых костный скелет формируется, они не подходят (выбирают жесткие модели).
От высоты зависит уют, красота спального места. 14–16 см – минимальная толщина. Для хорошей поддержки рекомендовано выбирать 20-23 см. Изделия высотой от 24 см считаются элитными, имеют улучшенные характеристики.
Хорошо себя зарекомендовали беспружинные модели и с независимым блоком пружин. Они повторяют контуры тела, что позволяет максимально разгрузить позвоночный столб от накопившейся усталости. Не скрипят, не продавливаются со временем.
Обращение в 4th House
Магазин матрасов в Москве «4th House» предлагает большой выбор моделей:

«Capricci»;
«Liberty»;
«Camelia»;
«Valery»;
«Sunrise» и другие.

Они изготовлены из гипоаллергенных материалов, устойчивых к деформации. Благодаря независимому пружинному блоку, отдых на них ещё приятнее. Цены на матрасы на сайте. Часто проводятся выгодные акции. Есть наличный, безналичный расчет. Чтобы купить матрас в интернет магазине, можно оставить заявку на сайте или связаться с менеджером по телефону.
 ";images/1.jpgЗачем нужна помощь логопеда?;"

Все родители без исключения желают, чтоб их дети имели успех в жизни в самых разных сферах.  И хорошая  речь  в этом отношении одна из основ в достижении цели.
Содержание
К чему приводят сложности с речьюПризнаки возникших проблемРабота с ребенкомЗначимость первой  консультацииК чему приводят сложности с речью
Ребенок, которому трудно общаться, постепенно становится замкнутым и это способствует   отставанию в развитии. Если же вовремя обратиться к логопеду, удается предотвратить множество проблем.   Бытует мнение, что к логопеду стоит обращаться уже  в период приближения к школе. Однако, в реальности лучше обращаться  к специалисту  уже в первые годы жизни ребенка. И здесь выход – консультация логопеда.

Признаки возникших проблем
Специалисты отмечают следующее:

младенец еще не начал лепетать;
ребенок не пытается произносить слова в первый год жизни;
достигнув двух-трех лет, ребенок неспособен строить простые предложения;
минимальный словарный запас;
трудности с произношением звуков;
сложности с концентрацией и памятью.

На затруднения в сфере общения могут и указывать иные признаки. Кроме того, логопед может не только помочь справиться с затруднениями в речи, но и определить в чем причины  их возникновения. Иногда  причина может  заключаться в травме или скрытых заболеваниях.
Работа с ребенком
Логопед может  достичь следующего:

обучить ребенка правильному произношению звуков;
правильно различать звуки, что поможет развить умение писать и читать, поможет  устранить риски возникновения дислексии и дисграфии;
обучить ребенка строить плавные и связные предложения, облегчая процесс обучения в школе или общения со сверстниками или ровесниками;
улучшить работу  координации  рук и пальцев, сделав более легким процесс обучения письму и рисованию;
развить воображение, образное мышление и память.

Плюсы обращения к логопеду не ограничиваются  указанным перечнем.
Значимость первой  консультации
На первой встрече со специалистом родители могут предоставить сведения, которую  дадут возможность разобраться, в чем собственно проблема и  каковы её корни.  Логопеда может интересовать  процесс протекания беременности, заболевания, возможные травмы  и т.д. Кроме того, логопед объяснит родителям, какой они способны внести вклад в решение проблемы, и что нужно делать с их стороны.
Логопед  может направить родителей при необходимости к специалистам другого профиля, например, к психологу. И ответит на интересующие вопросы. Практика показывает, что нередко обращать внимание стоит на иные аспекты, чем кажется изначально.
 ";images/1.jpgОтбеливание зубов: длительность и цена процедуры, эффективность;

Для красоты улыбки очень важно, чтобы зубы были белоснежными. Если эмаль пожелтевшая или почерневшая, улыбка скорее отпугнет, чем расположит к себе. К счастью, такая проблема, как изменение цвета эмали, не является трудноразрешимой. Чтобы избавиться от этого дефекта, нужно записаться и приехать на отбеливание зубов в ЦАО Москва, метро Краснопресненская, Улица 1905 года. Расположенное по этому адресу стоматология Лю-дент применяет для отбеливания зубов современные технологии ZOOM и Opalescence.

Стоимость и результат
Отбелить зубы можно недорого, даже если врач будет использовать самую современную технологию с дорогими расходниками. ZOOM — методика подразумевает использование геля, насыщенного перекисью водорода. Нанесенный на зубы препарат активизируется ультрафиолетовой лампой, что дало методике второе название – “фото отбеливание”. Технология позволяет достигать очень высоких результатов, осветлять зубы минимум до 8 тонов.
После визита к стоматологу исчезнут пятна и потемнения на эмали, возникшие от регулярного употребление кофе. Если клиент не бросит вредную привычку, результат долго не сохранится. Поэтому отбеливать зубы в таких случаях считается нецелесообразным. Стоимость отбеливания зависит от количества обработанных зубов и кратности обработки.
Процедура длится 15-20 минут. Это время нужно, чтобы выдержать однократно гель на эмали. Если результат нужно улучшить, процедуру придется повторить – так можно сделать 3 раза подряд. Цена обработки 1 зуба составляет 1-2 тысячи рублей.
Есть возможность профессионально отбелить две челюсти в линии улыбки за 19000 руб. Для этого используют отбеливание Opalescence – это гель с вязкой структурой, которую наносят под капы. Такое отбеливание эффективно, не повреждают зубную эмаль, но требует много времени. Зато результат сохраняется долго – до 7 лет.
Как проходит отбеливание Opalescence? Врач убедится, что десны здоровы, вылечит кариес, очистит эмаль от минерального налета. Затем возьмет специальные капы, на внутреннюю поверхность которых нанесен отбеливающий гель, и наденет их на зубы. Капы практически не видны, потому что сделаны из тонкого и прозрачного материала. Носить их нужно 30-60 минут в сутки. Надевать и снимать капы можно самостоятельно. Гель наносят каждый раз заново, используя тонкий шприц. Если необходимо, капы изготовит непосредственно стоматолог – это делает их ношение более удобным.
Профессиональное отбеливание зубов возвращает улыбке белоснежность и привлекательность. Непременно воспользуйтесь этой услугой, если эмаль на ваших зубах потемнела или пожелтела.

 ;images/1.jpgКупить Наборы кастрюль в Крыму, Симферополе, Севастополе, Ялте, Керчи;

Чем плох практичный подарок? Подобные сюрпризы смогут порадовать именинника, а также послужить ему верой и правдой. В качестве необычного презента можно купить кастрюли в Крыму здесь https://shen.com.ru/kastruli/, но перед приобретением нужно ознакомиться с влиянием материала, из которого изготовлена посуда, на вкус пищи.
Изделия бывают нескольких типов.

Содержание
ЭмалированныеАлюминиевыеЧугунныеСтеклянные и керамическиеИз нержавейкиЭмалированные
Такие кастрюли позволяют надолго решить вопрос с готовкой главных блюд. Посуда способствует быстрому вскипанию воды. Одно из непосредственных преимуществ эмалированных кастрюль состоит в отсутствии реакции пищи с покрытием. Продукты не окисляются.
В такой утвари можно долго хранить еду. За материалом легко ухаживать, но нужно исключить применение агрессивных моющих средств. Также стоит беречь эмаль от сильных механических повреждений, иначе она лопнет.
Алюминиевые
Идеальный бюджетный вариант. Посуда имеет небольшой вес. К сожалению, на этом плюсы заканчиваются. Алюминий отличается малым запасом прочности. Даже изделия с толстыми стенками неспособны долго прослужить. Такая посуда подвержена воздействию кислот и щелочей, поэтому в ней нельзя готовить супы и прочие первые блюда. В утвари можно варить яйца, овощи, вскипятить молоко, но не хранить пищу.
Чугунные
Тяжелые, долговечные, надежные кастрюли. Посуда подходит для приготовления ароматного плова. Утварь долго прогревается, а остывает ещё медленнее, что позволяет сохранить температуру готового блюда на протяжении длительного времени. Чугунные кастрюли универсальны в использовании. Их можно ставить в духовку и в холодильник, так как они устойчивы к температурным перепадам.
Стеклянные и керамические
Такие изделия относятся к современным моделям. Эстетически красивая, утварь можно подавать на стол прямо с готовым блюдом. К минусам относится повышенная хрупкость. Неаккуратным движением можно нанести серьёзное повреждение. Стеклянные и керамические кастрюли универсальны и экологичны, они подходят и для готовки, и для хранения пищи.
Из нержавейки
Долговечные, прочные и достаточно дорогие изделия. В утвари можно варить, жарить и тушить пищу. Спустя время сталь потускнеет и утратит блеск, но сохранит свои эксплуатационные характеристики.
В ассортименте этого интернет-магазина Shen https://shen.com.ru/ можно подобрать кастрюли в соответствии с предпочтениями, целями, бюджетом. Компания позаботилась о комфорте клиентов, поэтому предусмотрела доставку по Крыму.
 ;images/1.jpg