Покупать сейчас или ждать распродаж;"

Когда мы собираемся обновить свой гардероб, обычно единственное, что нас от этого останавливает, — цены в магазинах. Если они слишком высоки и наше финансовое положение пока не позволяет что-либо приобрести, есть вариант — подождать, пока магазин устроит распродажу с большими скидками.

Покупать ли сейчас или подождать подходящего момента, в котором стоимость товара будет ниже? Стоит ли вообще ждать такого момента или это не имеет смысла?
Цена: имеет ли смысл ждать снижения
Люди, которые считают, что лучше подождать, когда одежда будет стоить ниже, упускают из вида ещё одну возможность, лежащую на поверхности. Это — возможность купить новинку в другом магазине, где нужные вам джинсы, платье или туфли продаются по меньшей стоимости.
Вот почему это более правильно:

так вы сэкономите средства уже сегодня, приобретя нужный предмет гардероба;
за то время, что вы будете ждать, вероятно, что он будет уже продан — иногда лучше поторопиться;
может быть, вы посетите магазин с более качественным товаром, но без наценки на бренд;
скидки могут вообще никогда не появиться — потому ждать нет особого смысла.

Но есть и случаи, когда магазины действительно вводят скидки: это может быть приурочено к знаменательной дате (например, дню основания магазина), вызвано определённым событием (допустим, товара в этот раз больше, чем ожидалось) или просто быть ещё одной мерой для привлечения новых покупателей. Тогда одежда — в том числе брендовая — может достаться вам за полцены.
Где можно попасть на такие акции
Многие магазины несколько раз в год проводят акции, когда первоначальная стоимость товара снижается на несколько процентов. Скидка может быть и довольно ощутимой (до 50 и более процентов!).
Иногда скидки распространяются не на весь ассортимент, а только на определённые предметы. Например, покупатель ищет джинсы одной марки, но продавец уведомляет его, что он может приобрести похожие, но принадлежащие другой марке. На них в этот период действует скидка. Покупатель меняет свои планы в пользу модели, которая продавалась по акции.
Интернет-магазин Mega-Jeans тоже проводит такие акции. В соответствующем разделе сайта отображены те вещи, которые сейчас можно приобрести по сниженной цене.
Здесь представлена джинсовая одежда американских марок, таких, как Mustang, Levi’s, Lee Cooper, Wrangler, Guess и других. На сайте есть раздел, в котором вам помогут выбрать подходящие джинсы.

 ";images/1.jpgЗаказать свадьбу в Санкт-Петербурге;


Грамотно организованная свадебная церемония способна вдохновить молодожёнов, а также всех присутствующих на мероприятии, подарить незабываемые моменты. Однако нельзя сказать, что составление плана свадебного торжества и воплощение его в жизнь — лёгкие задачи. Часто молодые люди, вступающие в брак, не способны самостоятельно их решить. На это есть объективные причины. У молодожен, как правило, и без того хватает забот, требующих сил и времени. Организация торжества может стать для них непосильной задачей. К счастью, сегодня работают агентства, которым можно полностью доверить создание и оформление свадебного праздника.
Жители Санкт-Петербурга, желающие организовать свадебное мероприятие, могут рассчитывать на помощь компании Kasla Wedding. Её специалисты берут на себя все самые сложные задачи, связанные с созданием мероприятия. Воспользовавшись их услугами, можно рассчитывать на яркую и незабываемую свадьбу с тщательно подобранным ведущим, опытными фотографами. Чтобы Заказать свадьбу, стоит посетить онлайн-страницу данного агентства. На ней имеется информация о его работе, этапах организации торжеств, там же можно увидеть номер телефона для связи с менеджером.
Свадебное мероприятие является уникальным событием, его нельзя переиграть. Поэтому все детали праздника должны быть продуманы. Ведь даже небольшое недоразумение может стать неприятной ложкой дёгтя для молодожёнов. Поэтому важно, чтобы организацией свадьбы занимались люди, имеющие соответствующие знания и опыт. Молодые, вступающие в брак, чаще всего не сильны в решении подобных вопросов. Взявшись за составление плана мероприятия, они могут чего-то не рассчитать. В результате этого могут возникнуть ненужные ситуации, требующие дополнительных хлопот и нервов.
Оптимальным вариантом будет обращение к специалистам Kasla Wedding, которые знают все тонкости организации свадебных праздников. При этом они работают над планированием свадеб, учитывая индивидуальные предпочтения молодожёнов, их характер. Агентство может реализовать как шумные и энергичные мероприятия, так и спокойные и лиричные праздники — в зависимости от пожеланий заказчиков. Заказать свадьбу, оформленную в подходящей стиле, можно с помощью страницы организации. Если у клиентов возникнут вопросы, связанные с организацией торжеств, они могут рассчитывать на качественную консультацию менеджеров.

 ;images/1.jpg